{
  "$schema": "https://json-schema.org/draft/2020-12/schema",
  "type": "object",
  "additionalProperties": false,
  "required": ["name", "description", "image", "attributes"],
  "properties": {
    "name": { "type": "string", "minLength": 1 },
    "description": { "type": "string", "minLength": 1 },
    "image": { "type": "string", "format": "uri", "pattern": "^https://" },
    "attributes": {
      "type": "array",
      "items": {
        "type": "object",
        "additionalProperties": false,
        "required": ["trait_type", "value"],
        "properties": {
          "trait_type": { "type": "string" },
          "value": { "type": ["string", "number"] }
        }
      }
    }
  }
}
