{
  "name": "Ember Whelp",
  "description": "A rare hatchling from the Flame Nest.",
  "image": "/storage/v1/object/public/collectibles/ember_whelp_card.png",
  "attributes": [
    {
      "trait_type": "Rarity",
      "value": "RARE"
    },
    {
      "trait_type": "Type",
      "value": "PET"
    },
    {
      "trait_type": "Series",
      "value": "Dragon Fire"
    },
    {
      "trait_type": "Faction",
      "value": "Flame Nest"
    }
  ]
}
