{
  "name": "Inferno Crown Dragon",
  "description": "A legendary dragon crowned by fire.",
  "image": "/storage/v1/object/public/collectibles/inferno_crown_dragon_card.png",
  "attributes": [
    {
      "trait_type": "Rarity",
      "value": "LEGENDARY"
    },
    {
      "trait_type": "Type",
      "value": "PET"
    },
    {
      "trait_type": "Series",
      "value": "Dragon Fire"
    },
    {
      "trait_type": "Faction",
      "value": "Flame Nest"
    }
  ]
}
