{
  "name": "Ancient Leaf Sentinel",
  "description": "An old sentinel with roots under the launch gate.",
  "image": "/storage/v1/object/public/collectibles/ancient_leaf_sentinel_card.png",
  "attributes": [
    {
      "trait_type": "Rarity",
      "value": "EPIC"
    },
    {
      "trait_type": "Type",
      "value": "CHARACTER"
    },
    {
      "trait_type": "Series",
      "value": "Forest Guardians"
    },
    {
      "trait_type": "Faction",
      "value": "Forest Pact"
    }
  ]
}
