{
  "name": "Blazewing Drake",
  "description": "An epic drake that guards molten trails.",
  "image": "/storage/v1/object/public/collectibles/blazewing_drake_card.png",
  "attributes": [
    {
      "trait_type": "Rarity",
      "value": "EPIC"
    },
    {
      "trait_type": "Type",
      "value": "PET"
    },
    {
      "trait_type": "Series",
      "value": "Dragon Fire"
    },
    {
      "trait_type": "Faction",
      "value": "Flame Nest"
    }
  ]
}
