{
  "name": "Forest Sproutling",
  "description": "A young scout watching the green borderlands.",
  "image": "/storage/v1/object/public/collectibles/forest_sproutling_card.png",
  "attributes": [
    {
      "trait_type": "Rarity",
      "value": "COMMON"
    },
    {
      "trait_type": "Type",
      "value": "CHARACTER"
    },
    {
      "trait_type": "Series",
      "value": "Forest Guardians"
    },
    {
      "trait_type": "Faction",
      "value": "Forest Pact"
    }
  ]
}
