{
  "name": "Moonlit Minstrel",
  "description": "A silver-voiced performer of the Lunar Court.",
  "image": "/storage/v1/object/public/collectibles/moonlit_minstrel_card.png",
  "attributes": [
    {
      "trait_type": "Rarity",
      "value": "RARE"
    },
    {
      "trait_type": "Type",
      "value": "CHARACTER"
    },
    {
      "trait_type": "Series",
      "value": "Moon Crown"
    },
    {
      "trait_type": "Faction",
      "value": "Lunar Court"
    }
  ]
}
