{
  "name": "Prism Tide Oracle",
  "description": "An epic oracle of the crystal tide.",
  "image": "/storage/v1/object/public/collectibles/prism_tide_oracle_card.png",
  "attributes": [
    {
      "trait_type": "Rarity",
      "value": "EPIC"
    },
    {
      "trait_type": "Type",
      "value": "CHARACTER"
    },
    {
      "trait_type": "Series",
      "value": "Crystal Cove"
    },
    {
      "trait_type": "Faction",
      "value": "Crystal Tide"
    }
  ]
}
