{
  "name": "Mooncap Bard",
  "description": "A tiny mushroom singer under the new moon.",
  "image": "/storage/v1/object/public/collectibles/mooncap_bard_card.png",
  "attributes": [
    {
      "trait_type": "Rarity",
      "value": "COMMON"
    },
    {
      "trait_type": "Type",
      "value": "CHARACTER"
    },
    {
      "trait_type": "Series",
      "value": "Moon Crown"
    },
    {
      "trait_type": "Faction",
      "value": "Lunar Court"
    }
  ]
}
